,song_id,title,artist,year,chunk_id,lyrics_chunk,line_count,url
754,7013838,Terminal Paradise Live at The Bunker Studio,Big Thief,2021,3,"Terminal
We both know
Let me rest
Let me go",4,https://open.spotify.com/track/5xz1cnixgffBf5GtKaMjax?si=322cc094acd74552
755,7013838,Terminal Paradise Live at The Bunker Studio,Big Thief,2021,4,"See my death become a trail
And the trail leads to a flower
I will blossom in your sail
Every dream and waking hour",4,https://open.spotify.com/track/5xz1cnixgffBf5GtKaMjax?si=322cc094acd74553
756,7013838,Terminal Paradise Live at The Bunker Studio,Big Thief,2021,5,"Woman
Woman
Hold me in your heat
'Til I re--- don't let me",4,https://open.spotify.com/track/5xz1cnixgffBf5GtKaMjax?si=322cc094acd74554
757,7013838,Terminal Paradise Live at The Bunker Studio,Big Thief,2021,6,"'Til I re--- don't let me
I remember",2,https://open.spotify.com/track/5xz1cnixgffBf5GtKaMjax?si=322cc094acd74555
758,7013838,Terminal Paradise Live at The Bunker Studio,Big Thief,2021,7,"Terminal
We both know
Let me rest, let me go
See my death bеcome a trail",4,https://open.spotify.com/track/5xz1cnixgffBf5GtKaMjax?si=322cc094acd74556
759,7013838,Terminal Paradise Live at The Bunker Studio,Big Thief,2021,8,"And the trail leads to a flowеr
I will blossom in your sail
Every dream and waking hour",3,https://open.spotify.com/track/5xz1cnixgffBf5GtKaMjax?si=322cc094acd74557
760,7013838,Terminal Paradise Live at The Bunker Studio,Big Thief,2021,9,"Swagger
Alright
That's a wrap!",3,https://open.spotify.com/track/5xz1cnixgffBf5GtKaMjax?si=322cc094acd74558
761,7013905,Cattails Live at The Bunker Studio,Big Thief,2021,1,"Maybe I should make it more dead like
I kinda like it
I liked it before, like, how clear it is
Maybe a little more dead",4,https://open.spotify.com/track/7wNzAMdRbq1lnFBBPthFM5?si=181598a875534616
762,7013905,Cattails Live at The Bunker Studio,Big Thief,2021,2,"Yeah, that's nice",1,https://open.spotify.com/track/7wNzAMdRbq1lnFBBPthFM5?si=181598a875534617
763,7013905,Cattails Live at The Bunker Studio,Big Thief,2021,3,"Caroline, Caroline
I never could leave you to struggle
Hold the line, hold the line
I’ll be there on the double",4,https://open.spotify.com/track/7wNzAMdRbq1lnFBBPthFM5?si=181598a875534618
764,7013905,Cattails Live at The Bunker Studio,Big Thief,2021,4,"In time, in time
Everyone does see trouble",2,https://open.spotify.com/track/7wNzAMdRbq1lnFBBPthFM5?si=181598a875534619
765,7013905,Cattails Live at The Bunker Studio,Big Thief,2021,5,"And you don’t need to know why when you cry
You don’t need to know why
You don’t need to know why when you cry",3,https://open.spotify.com/track/7wNzAMdRbq1lnFBBPthFM5?si=181598a875534620
766,7013905,Cattails Live at The Bunker Studio,Big Thief,2021,6,"Violet’s eyes, Violet plays
Going back home to the Great Lakes
Where the cattail sways
With a lonesome loon",4,https://open.spotify.com/track/7wNzAMdRbq1lnFBBPthFM5?si=181598a875534621
767,7013905,Cattails Live at The Bunker Studio,Big Thief,2021,7,You'll riding that train in late June,1,https://open.spotify.com/track/7wNzAMdRbq1lnFBBPthFM5?si=181598a875534622
768,7013905,Cattails Live at The Bunker Studio,Big Thief,2021,8,"With the windows wide by your side
With the windows wide
With the windows wide by your side",3,https://open.spotify.com/track/7wNzAMdRbq1lnFBBPthFM5?si=181598a875534623
769,7013905,Cattails Live at The Bunker Studio,Big Thief,2021,9,"And the clusters fell like an empty bell
Meteor shower at the motel
Where the empty space is a saving grace
Making good time and doing well",4,https://open.spotify.com/track/7wNzAMdRbq1lnFBBPthFM5?si=181598a875534624
770,7013905,Cattails Live at The Bunker Studio,Big Thief,2021,10,"But still the question sings like Saturn’s rings
Maybe she knows and she won’t tell",2,https://open.spotify.com/track/7wNzAMdRbq1lnFBBPthFM5?si=181598a875534625
771,7013905,Cattails Live at The Bunker Studio,Big Thief,2021,11,"But you don’t need to know why when you cry
You don’t need to know why
You don’t need to know why when you cry",3,https://open.spotify.com/track/7wNzAMdRbq1lnFBBPthFM5?si=181598a875534626
772,7013905,Cattails Live at The Bunker Studio,Big Thief,2021,12,"And I find you there in your country flair
Middle of the river in a lawn chair
With your wrinkled hands and your silver hair
Leaving me soon and you know where",4,https://open.spotify.com/track/7wNzAMdRbq1lnFBBPthFM5?si=181598a875534627
773,7013905,Cattails Live at The Bunker Studio,Big Thief,2021,13,"To where the cattail sways with the lonesome loon
You’ll be riding that train in late June",2,https://open.spotify.com/track/7wNzAMdRbq1lnFBBPthFM5?si=181598a875534628
774,7013905,Cattails Live at The Bunker Studio,Big Thief,2021,14,"With the windows wide by your side
With the windows wide
With the windows wide by your side
And you don’t need to know why",4,https://open.spotify.com/track/7wNzAMdRbq1lnFBBPthFM5?si=181598a875534629
775,7013905,Cattails Live at The Bunker Studio,Big Thief,2021,15,You don’t need to know why when you cry,1,https://open.spotify.com/track/7wNzAMdRbq1lnFBBPthFM5?si=181598a875534630
776,7013905,Cattails Live at The Bunker Studio,Big Thief,2021,16,"Cool
I liked it- I wish it stayed dry at the end
That yeah
I felt like that would have been the",4,https://open.spotify.com/track/7wNzAMdRbq1lnFBBPthFM5?si=181598a875534631
777,7013905,Cattails Live at The Bunker Studio,Big Thief,2021,17,"Like the show yesterday, you told me you liked that one, so I threw it onto the",1,https://open.spotify.com/track/7wNzAMdRbq1lnFBBPthFM5?si=181598a875534632
778,7013938,Shoulders Live at The Bunker Studio,Big Thief,2021,1,"Please wake up
Please wake up
Touch my skin and tell me where you've been
You brought me in",4,https://open.spotify.com/track/2hTKzGRH6bnxVf2aQCB257?si=d712e563d4274e23
779,7013938,Shoulders Live at The Bunker Studio,Big Thief,2021,2,"You brought me in
So touch my skin and tell me where you've been
You showed me how
To keep myself from burning out",4,https://open.spotify.com/track/2hTKzGRH6bnxVf2aQCB257?si=d712e563d4274e24
780,7013938,Shoulders Live at The Bunker Studio,Big Thief,2021,3,"They found you in the morning
The blood was on your shoulders
They found you at the corner
Your head was doubled over",4,https://open.spotify.com/track/2hTKzGRH6bnxVf2aQCB257?si=d712e563d4274e25
781,7013938,Shoulders Live at The Bunker Studio,Big Thief,2021,4,"And the blood of the man
Who killed my mother with his hands
Is in me, it's in me, in my veins",3,https://open.spotify.com/track/2hTKzGRH6bnxVf2aQCB257?si=d712e563d4274e26
782,7013938,Shoulders Live at The Bunker Studio,Big Thief,2021,5,"Please wake up
Please wake up
Touch my skin and tell me where you've been
You brought me in",4,https://open.spotify.com/track/2hTKzGRH6bnxVf2aQCB257?si=d712e563d4274e27
783,7013938,Shoulders Live at The Bunker Studio,Big Thief,2021,6,"My best friend
So touch my skin and tell me where you've been
You showed me how
To hold my sin",4,https://open.spotify.com/track/2hTKzGRH6bnxVf2aQCB257?si=d712e563d4274e28
784,7013938,Shoulders Live at The Bunker Studio,Big Thief,2021,7,And kiss the bad ways I have been,1,https://open.spotify.com/track/2hTKzGRH6bnxVf2aQCB257?si=d712e563d4274e29
785,7013938,Shoulders Live at The Bunker Studio,Big Thief,2021,8,"They found you in the morning
The blood was on your shoulders
They found you at the corner
Your head was doubled over",4,https://open.spotify.com/track/2hTKzGRH6bnxVf2aQCB257?si=d712e563d4274e30
786,7013938,Shoulders Live at The Bunker Studio,Big Thief,2021,9,"And the blood of the man
Who's killing our mother with his hands
Is in me, it's in me, in my veins
It's in me, it's in me, in my veins",4,https://open.spotify.com/track/2hTKzGRH6bnxVf2aQCB257?si=d712e563d4274e31
787,7013938,Shoulders Live at The Bunker Studio,Big Thief,2021,10,"One hundred percent I think I liked that one better
I liked that one better
Yeah, it's a better take
Take two was better",4,https://open.spotify.com/track/2hTKzGRH6bnxVf2aQCB257?si=d712e563d4274e32
788,7013938,Shoulders Live at The Bunker Studio,Big Thief,2021,11,"Take two was shortest
Take t---
Yeah
That take?",4,https://open.spotify.com/track/2hTKzGRH6bnxVf2aQCB257?si=d712e563d4274e33
789,7013938,Shoulders Live at The Bunker Studio,Big Thief,2021,12,Take that take,1,https://open.spotify.com/track/2hTKzGRH6bnxVf2aQCB257?si=d712e563d4274e34
790,7050908,Heavy Bend,Big Thief,2022,1,Yeah,1,https://open.spotify.com/track/6qopJBPesEVIrIT0qMtbNs?si=f09f00cf52204fd5
791,7050908,Heavy Bend,Big Thief,2022,2,"Came to light on a very hot day
The grass was sweating
You were sleeping in
With the window open",4,https://open.spotify.com/track/6qopJBPesEVIrIT0qMtbNs?si=f09f00cf52204fd6
792,7050908,Heavy Bend,Big Thief,2022,3,"The blanket breathing
Cigarette on a golden ashtray
Your golden hair lay
In the swollen sunray",4,https://open.spotify.com/track/6qopJBPesEVIrIT0qMtbNs?si=f09f00cf52204fd7
793,7050908,Heavy Bend,Big Thief,2022,4,The withered roses hanging in the doorway,1,https://open.spotify.com/track/6qopJBPesEVIrIT0qMtbNs?si=f09f00cf52204fd8
794,7050908,Heavy Bend,Big Thief,2022,5,"Don't wanna be right
Don't wanna be let down
Don't wanna fight
Don't wanna pretend",4,https://open.spotify.com/track/6qopJBPesEVIrIT0qMtbNs?si=f09f00cf52204fd9
795,7050908,Heavy Bend,Big Thief,2022,6,"Formless secret
Heavy bend
Heavy bend",3,https://open.spotify.com/track/6qopJBPesEVIrIT0qMtbNs?si=f09f00cf52204fd10
796,7050908,Heavy Bend,Big Thief,2022,7,"Second sight and the clouds above you
As the wilderness grew thickеr and the crow flew
Tossing and turning, your forehеad burning",3,https://open.spotify.com/track/6qopJBPesEVIrIT0qMtbNs?si=f09f00cf52204fd11
797,7050908,Heavy Bend,Big Thief,2022,8,"Don't wanna be right
Don't wanna be let down
Don't wanna fight
Don't wanna defend",4,https://open.spotify.com/track/6qopJBPesEVIrIT0qMtbNs?si=f09f00cf52204fd12
798,7050908,Heavy Bend,Big Thief,2022,9,"Formless secret
Heavy bend
From the empty height
Flies on the ceiling now",4,https://open.spotify.com/track/6qopJBPesEVIrIT0qMtbNs?si=f09f00cf52204fd13
799,7050908,Heavy Bend,Big Thief,2022,10,"I wanna hold you tight
Don't wanna pretend
Formless secret
Heavy bend",4,https://open.spotify.com/track/6qopJBPesEVIrIT0qMtbNs?si=f09f00cf52204fd14
800,7050908,Heavy Bend,Big Thief,2022,11,"Heavy bend
Heavy bend",2,https://open.spotify.com/track/6qopJBPesEVIrIT0qMtbNs?si=f09f00cf52204fd15
801,7092001,Little Things,Big Thief,2021,1,"The little things I like about you
How you say when you say what you do
When your feeling is a little gold and blue
When your feeling is a little strung out",4,https://open.spotify.com/track/5ZlfX4evbtQtONINsLADDR?si=356b0887a3814bc8
802,7092001,Little Things,Big Thief,2021,2,"Everything we talk about
Living in the city is a crowded place
I still lose sight of every other face",3,https://open.spotify.com/track/5ZlfX4evbtQtONINsLADDR?si=356b0887a3814bc9
803,7092001,Little Things,Big Thief,2021,3,"Turn in your direction
Feeling like I need attention
I told you this once or twice
Won't you hear?",4,https://open.spotify.com/track/5ZlfX4evbtQtONINsLADDR?si=356b0887a3814bc10
804,7092001,Little Things,Big Thief,2021,4,"I see you in the yard drinking a beer
Leaving me undressed
Like some cheap classic movie
Maybe I'm a little obsessed",4,https://open.spotify.com/track/5ZlfX4evbtQtONINsLADDR?si=356b0887a3814bc11
805,7092001,Little Things,Big Thief,2021,5,Maybe you do use me,1,https://open.spotify.com/track/5ZlfX4evbtQtONINsLADDR?si=356b0887a3814bc12
806,7092001,Little Things,Big Thief,2021,6,"One step behind you
Following you down
I was inside of you
Kissing your mouth",4,https://open.spotify.com/track/5ZlfX4evbtQtONINsLADDR?si=356b0887a3814bc13
807,7092001,Little Things,Big Thief,2021,7,"You were inside of me
Kissing my mouth
Seeing out that needle eye
Seeing out that needle eye",4,https://open.spotify.com/track/5ZlfX4evbtQtONINsLADDR?si=356b0887a3814bc14
808,7092001,Little Things,Big Thief,2021,8,Seeing out that needle eye,1,https://open.spotify.com/track/5ZlfX4evbtQtONINsLADDR?si=356b0887a3814bc15
809,7092001,Little Things,Big Thief,2021,9,"The little things I like about you
How you say when you say what you do
When your feeling is a little gold and blue
When your feeling is a little strung out",4,https://open.spotify.com/track/5ZlfX4evbtQtONINsLADDR?si=356b0887a3814bc16
810,7092001,Little Things,Big Thief,2021,10,"Everything we talk about
New York City is a crowded place
I still lose sight of every other face",3,https://open.spotify.com/track/5ZlfX4evbtQtONINsLADDR?si=356b0887a3814bc17
811,7092001,Little Things,Big Thief,2021,11,"One step behind you
Following you down
I was inside of you
Where are you now?",4,https://open.spotify.com/track/5ZlfX4evbtQtONINsLADDR?si=356b0887a3814bc18
812,7092001,Little Things,Big Thief,2021,12,Where are you now? (Ah),1,https://open.spotify.com/track/5ZlfX4evbtQtONINsLADDR?si=356b0887a3814bc19
813,7092001,Little Things,Big Thief,2021,13,"Ah, oh
The things I love
The things, the things I like
Will you stay?",4,https://open.spotify.com/track/5ZlfX4evbtQtONINsLADDR?si=356b0887a3814bc20
814,7092001,Little Things,Big Thief,2021,14,"Will you feel?
You'll feel
Oh-oh, ooh",3,https://open.spotify.com/track/5ZlfX4evbtQtONINsLADDR?si=356b0887a3814bc21
815,7135742,Once a Buncha Times,Big Thief,2021,1,"Once a buncha times I took it too hard
Everything you told me I took it apart
I pulled you in and pushed you out right from the start
I was leaving before I'd arrived",4,
816,7135742,Once a Buncha Times,Big Thief,2021,2,"Eyes are magnetic, that moldavite flame
Stopping the traffic, all six lanes
You're callin' me baby, barely sayin' my name
I was leaving before I'd arrived",4,
817,7135742,Once a Buncha Times,Big Thief,2021,3,"Half a margarita, have a little dance
Let's fine dine the demons and give peace a chance",2,
818,7135742,Once a Buncha Times,Big Thief,2021,4,"On a Tuesday in August, I was holdin' your hand
By Wednesday in August, I was playin' with my band
Then Thursday in August, I was makin' a plan
Thеn I shut like a shuttered Friday",4,
819,7135742,Once a Buncha Times,Big Thief,2021,5,"Your lips arе electric like lightning and rain
Your tastes are eclectic, multigrain
You pull on my shoestrings and you open my brain
But I was leaving before I'd arrived",4,
820,7135742,Once a Buncha Times,Big Thief,2021,6,"Half a margarita, have a little dance
Let's fine dine the demons and give peace a chance",2,
821,7135742,Once a Buncha Times,Big Thief,2021,7,"We could talk for hours, I could buy you flowers
We could switch off in the movies, we could switch off in showers
We can turn it up (up), turn it down (down), watch Austin Powers
But I was leaving before I'd arrived",4,
822,7135742,Once a Buncha Times,Big Thief,2021,8,"I'm fairly good at takin' a small thing and blowin' it up real big
I couldn't fit it in my wallet, I couldn't fit it in my rig
I can twist it in, twist it out, can really dig
About leavin' before I'd arrived",4,
823,7135742,Once a Buncha Times,Big Thief,2021,9,"Half a margarita, have a little dance
Let's fine dine the demons and give peace a chance",2,
824,7135742,Once a Buncha Times,Big Thief,2021,10,"You believe in me some, you believe in me a lot
You see all the good things I seem to've forgot
You can cheer me up and calm me down, you know the spot
You say """"Honey won't you stay a little while?""""",4,
825,7135742,Once a Buncha Times,Big Thief,2021,11,"You can make me smile just by lookin' around
You take me to the invisible lost and found
Where I can find a sweater or an old love letter
About leaving before I'd arrived",4,
826,7135742,Once a Buncha Times,Big Thief,2021,12,"We can flapjack a nickel, pancake a dime
Waffle a tickle, french toast wine
We can take in bacon, sunshine
Tee off with a coffee and a tan",4,
827,7135742,Once a Buncha Times,Big Thief,2021,13,"Half a margarita, have a little dance
Let's fine dine the demons and give peace a chance
Half a margarita, have a little dance
Let's fine dine the demons and give peace a chance",4,
828,7135742,Once a Buncha Times,Big Thief,2021,14,I say lets fine dine the demons and save all the ants,1,
829,7135752,Certainty,Big Thief,2021,1,"Name on the line, last request
Pull the car over to find some rest
Saying """"I love you""""
Need to lie here, need to leave",4,https://open.spotify.com/track/3i7XRi2UyvGTdJawJRkVhd?si=cf8b97bad8a24416
830,7135752,Certainty,Big Thief,2021,2,"Living in the debt of make-believe
Saying I owe you
Crooked as a crow gnawing on dawn
Shadow from the grass in the dirt on the lawn",4,https://open.spotify.com/track/3i7XRi2UyvGTdJawJRkVhd?si=cf8b97bad8a24417
831,7135752,Certainty,Big Thief,2021,3,Why do I string you along?,1,https://open.spotify.com/track/3i7XRi2UyvGTdJawJRkVhd?si=cf8b97bad8a24418
832,7135752,Certainty,Big Thief,2021,4,"My certainty is wild, weaving
For you, I am a child, believing
You lay beside me sleeping on a plane
In the future",4,https://open.spotify.com/track/3i7XRi2UyvGTdJawJRkVhd?si=cf8b97bad8a24419
833,7135752,Certainty,Big Thief,2021,5,"Sit on the phone, watch TV
Romance, action, mystery
Wanted to show you
Sine wave is a particle ride",4,https://open.spotify.com/track/3i7XRi2UyvGTdJawJRkVhd?si=cf8b97bad8a24420
834,7135752,Certainty,Big Thief,2021,6,"Bring your light out, then in on the tide
Maybe I love you
Maybe I love you is a river so high
Maybe I love you is a river so low",4,https://open.spotify.com/track/3i7XRi2UyvGTdJawJRkVhd?si=cf8b97bad8a24421
835,7135752,Certainty,Big Thief,2021,7,"I love you, still don't know",1,https://open.spotify.com/track/3i7XRi2UyvGTdJawJRkVhd?si=cf8b97bad8a24422
836,7135752,Certainty,Big Thief,2021,8,"My certainty is wild, weaving
For you, I am a child, believing
You lay beside me sleeping on a plane
In the future",4,https://open.spotify.com/track/3i7XRi2UyvGTdJawJRkVhd?si=cf8b97bad8a24423
837,7135752,Certainty,Big Thief,2021,9,"My certainty is wild, weaving
For you, I am a child, believing
You lay beside me sleeping on a plane
In the future",4,https://open.spotify.com/track/3i7XRi2UyvGTdJawJRkVhd?si=cf8b97bad8a24424
838,7135756,Dragon New Warm Mountain I Believe in You,Big Thief,2022,1,"It's a little bit magic
Like a river of morning geese
In the new warm mountain
Where the stone face forms and speaks",4,https://open.spotify.com/track/3UN7R1teOKhmB8SnxtwiPK?si=411b75a804184040
839,7135756,Dragon New Warm Mountain I Believe in You,Big Thief,2022,2,"I believe in you
Even when you need to
Recoil",3,https://open.spotify.com/track/3UN7R1teOKhmB8SnxtwiPK?si=411b75a804184041
840,7135756,Dragon New Warm Mountain I Believe in You,Big Thief,2022,3,"When the topsoil
Is kicking up into the storm
And the dust goes dancing
And a billion planets are born",4,https://open.spotify.com/track/3UN7R1teOKhmB8SnxtwiPK?si=411b75a804184042
841,7135756,Dragon New Warm Mountain I Believe in You,Big Thief,2022,4,"I believe in you
Even when you need to
Recoil",3,https://open.spotify.com/track/3UN7R1teOKhmB8SnxtwiPK?si=411b75a804184043
842,7135756,Dragon New Warm Mountain I Believe in You,Big Thief,2022,5,"Just like that
The moon goes flat
Big lights in the city shine
Crying out",4,https://open.spotify.com/track/3UN7R1teOKhmB8SnxtwiPK?si=411b75a804184044
843,7135756,Dragon New Warm Mountain I Believe in You,Big Thief,2022,6,Take me to the limits of your love,1,https://open.spotify.com/track/3UN7R1teOKhmB8SnxtwiPK?si=411b75a804184045
844,7135756,Dragon New Warm Mountain I Believe in You,Big Thief,2022,7,"There's a dragon in thе phone line
Coughing up a mighty flame
With a tonguе of silver, silver
Calling out my oldest name",4,https://open.spotify.com/track/3UN7R1teOKhmB8SnxtwiPK?si=411b75a804184046
845,7135756,Dragon New Warm Mountain I Believe in You,Big Thief,2022,8,"She says, """"Hey, you
Do you remember me too?""""
We were coiling",3,https://open.spotify.com/track/3UN7R1teOKhmB8SnxtwiPK?si=411b75a804184047
846,7135756,Dragon New Warm Mountain I Believe in You,Big Thief,2022,9,"It's a little bit magic
Magic
A little bit magic
Magic",4,https://open.spotify.com/track/3UN7R1teOKhmB8SnxtwiPK?si=411b75a804184048
847,7190828,Red Moon,Big Thief,2022,1,"Red moon rising like a fire in me
So many questions, she asks them all to me
I have to answer most curiously
Scarlet angel, I am too small to see",4,https://open.spotify.com/track/3AqSeHqtg45ddsAYJeuCqm?si=5e0424452a6a465d
848,7190828,Red Moon,Big Thief,2022,2,"Earn, earn, shuffle 'round the big city
Burning the rubber down, crossing the hot concrete
I'm gonna leave town, there is someone to meet
She turns her head around a full three-sixty",4,https://open.spotify.com/track/3AqSeHqtg45ddsAYJeuCqm?si=5e0424452a6a465d
849,7190828,Red Moon,Big Thief,2022,3,Woo,1,https://open.spotify.com/track/3AqSeHqtg45ddsAYJeuCqm?si=5e0424452a6a465d
850,7190828,Red Moon,Big Thief,2022,4,"Bedroom rising from an old growth tree
Bringing out the sawmill, cutting the twelve-inch beams
Building a pattern, the reservoir to fill with dreams
Rings like Saturn telling their old story",4,https://open.spotify.com/track/3AqSeHqtg45ddsAYJeuCqm?si=5e0424452a6a465d
851,7190828,Red Moon,Big Thief,2022,5,"Windmills turn and turn eternally
What do you yearn for? Where do you long to be?
I've been here before, looking at the wild country
Open the screen door, talking with Diane Lee",4,https://open.spotify.com/track/3AqSeHqtg45ddsAYJeuCqm?si=5e0424452a6a465d
852,7190828,Red Moon,Big Thief,2022,6,That's my grandma,1,https://open.spotify.com/track/3AqSeHqtg45ddsAYJeuCqm?si=5e0424452a6a465d
853,7190828,Red Moon,Big Thief,2022,7,"Radio singing from the corner of the kitchen
I got the oven on, I got the onions wishing
They hadn't made me cry, filling the sink with dishes
Letting them air dry, waiting for the wind's permission",4,https://open.spotify.com/track/3AqSeHqtg45ddsAYJeuCqm?si=5e0424452a6a465d
854,7190828,Red Moon,Big Thief,2022,8,"Too many movies got me shivering and shy
Turning the lights out, glistening in the owl's eye
Glimmer like lightning under the violet sky
Shimmer like diamonds, watching the red moon rise",4,https://open.spotify.com/track/3AqSeHqtg45ddsAYJeuCqm?si=5e0424452a6a465d
855,7190828,Red Moon,Big Thief,2022,9,Ooh,1,https://open.spotify.com/track/3AqSeHqtg45ddsAYJeuCqm?si=5e0424452a6a465d
856,7202871,Geese,Big Thief,2021,1,"The last time
The last time we were here I was two
I watched you reappear from the scarlet sky
The wild geese were returning",4,
857,7202871,Geese,Big Thief,2021,2,"Falling embers from the burning April sun
How this place has changed, like my voice
The wildflowers drink the rain, they have no choice
All their faces getting wet",4,
858,7202871,Geese,Big Thief,2021,3,"They just sway so slow and let the water wash them
Now your eyеs too, fill with water
As your face turns to your daughter, dull and grеy
What's a valley gonna say as her trees are stripped away without warning",4,
859,7202871,Geese,Big Thief,2021,4,"The last time we were here the wind was colder
Snow rose to my ear, and to your shoulder
I took a crooked photograph
Froze the second of your laughter, rosy cheeks",4,
860,7202871,Geese,Big Thief,2021,5,"Now the months turn into weeks
As the violet crystal shrinks, you may not meet her
What's the winter gonna do
As her ice runs hot and blue",4,
861,7204698,Flower of Blood,Big Thief,2022,1,"Give me some time on Earth to know you
Help me unearth the map and show you
Thinking of her, thinking of him, want to?
When you touch me",4,https://open.spotify.com/track/3pMTFpbool5GOxvoc2QJth?si=7ea49af528a845c9
862,7204698,Flower of Blood,Big Thief,2022,2,"Mirror in the sky
Making me cry again
Roll up the sheets, suddenly frozen
Like a knife carving through my thick skin",4,https://open.spotify.com/track/3pMTFpbool5GOxvoc2QJth?si=7ea49af528a845c10
863,7204698,Flower of Blood,Big Thief,2022,3,"When you touch me
When you touch me",2,https://open.spotify.com/track/3pMTFpbool5GOxvoc2QJth?si=7ea49af528a845c11
864,7204698,Flower of Blood,Big Thief,2022,4,"Hearing you sigh soft and heavy
Holding mine 'til you feel ready
Flower of blood bloom on my tongue, steady
When you touch me",4,https://open.spotify.com/track/3pMTFpbool5GOxvoc2QJth?si=7ea49af528a845c12
865,7204698,Flower of Blood,Big Thief,2022,5,When you touch me,1,https://open.spotify.com/track/3pMTFpbool5GOxvoc2QJth?si=7ea49af528a845c13
866,7204698,Flower of Blood,Big Thief,2022,6,"Flower of blood
Flower of blood bloom on my tongue",2,https://open.spotify.com/track/3pMTFpbool5GOxvoc2QJth?si=7ea49af528a845c14
867,7204698,Flower of Blood,Big Thief,2022,7,"When you find the lonely tower
Climb inside the darkеst room
Feel afraid, surrender your power
Whеn you touch me",4,https://open.spotify.com/track/3pMTFpbool5GOxvoc2QJth?si=7ea49af528a845c15
868,7204698,Flower of Blood,Big Thief,2022,8,"When you touch me
When you touch me",2,https://open.spotify.com/track/3pMTFpbool5GOxvoc2QJth?si=7ea49af528a845c16
869,7204698,Flower of Blood,Big Thief,2022,9,"Feel afraid, surrender your power",1,https://open.spotify.com/track/3pMTFpbool5GOxvoc2QJth?si=7ea49af528a845c17
870,7217473,Blurred View,Big Thief,2022,1,"I am the magazine
The blue screen
The big hand moving past the last thing
I turn for you, turn for you",4,https://open.spotify.com/track/5MFBgS4j9HMn04mRPrdAr2?si=56e3929481104329
871,7217473,Blurred View,Big Thief,2022,2,"Turn for you, turn for you
I am the private room
The quiet croon
The grey eye blinking on the new moon",4,https://open.spotify.com/track/5MFBgS4j9HMn04mRPrdAr2?si=56e3929481104329
872,7217473,Blurred View,Big Thief,2022,3,"I burn for you, burn for you
Burn for you, burn for you
Within the last kiss
I am the genesis",4,https://open.spotify.com/track/5MFBgS4j9HMn04mRPrdAr2?si=56e3929481104329
