,song_id,title,artist,year,chunk_id,lyrics_chunk,line_count,url
230,3623825,Not,Big Thief,2019,3,"It's not the formless being
Nor the cry in the air
Nor the boy I'm seeing
With her long black hair",4,https://open.spotify.com/track/7lrhugjSbiImrNSLIFIq0c?si=e3a9101b8fca4e51
231,3623825,Not,Big Thief,2019,4,"It's not the open weaving
Nor the furnace glow
Nor the blood of you bleeding
As you try to let go",4,https://open.spotify.com/track/7lrhugjSbiImrNSLIFIq0c?si=e3a9101b8fca4e52
232,3623825,Not,Big Thief,2019,5,"It's not the room
Not beginning
Not the crowd
Not winning",4,https://open.spotify.com/track/7lrhugjSbiImrNSLIFIq0c?si=e3a9101b8fca4e53
233,3623825,Not,Big Thief,2019,6,"Not the planet
Not spinning
Not a ruse
Not heat",4,https://open.spotify.com/track/7lrhugjSbiImrNSLIFIq0c?si=e3a9101b8fca4e54
234,3623825,Not,Big Thief,2019,7,"Not the fire lapping up the creek
Not food
Not to eat",3,https://open.spotify.com/track/7lrhugjSbiImrNSLIFIq0c?si=e3a9101b8fca4e55
235,3623825,Not,Big Thief,2019,8,"Not the meat of your thigh
Nor your spine tattoo
Nor your shimmery eye
Nor the wet of the dew",4,https://open.spotify.com/track/7lrhugjSbiImrNSLIFIq0c?si=e3a9101b8fca4e56
236,3623825,Not,Big Thief,2019,9,"It's not the warm illusion
Nor the crack in the plate
Nor the breath of confusion
Nor the starkness of slate",4,https://open.spotify.com/track/7lrhugjSbiImrNSLIFIq0c?si=e3a9101b8fca4e57
237,3623825,Not,Big Thief,2019,10,"It's not the room
Not beginning
Not the crowd
Not winning",4,https://open.spotify.com/track/7lrhugjSbiImrNSLIFIq0c?si=e3a9101b8fca4e58
238,3623825,Not,Big Thief,2019,11,"Not the planet
Not spinning
Not a ruse
Not heat",4,https://open.spotify.com/track/7lrhugjSbiImrNSLIFIq0c?si=e3a9101b8fca4e59
239,3623825,Not,Big Thief,2019,12,"Not the fire lapping up the creek
Not food
Not to eat",3,https://open.spotify.com/track/7lrhugjSbiImrNSLIFIq0c?si=e3a9101b8fca4e60
240,3623825,Not,Big Thief,2019,13,"Not what you really wanted
Nor the mess in your purse
Nor the bed that is haunted
With the blanket of thirst",4,https://open.spotify.com/track/7lrhugjSbiImrNSLIFIq0c?si=e3a9101b8fca4e61
241,3623825,Not,Big Thief,2019,14,"It's not the hunger revealing
Nor the ricochet in the cave
Nor the hand that is healing
Nor the nameless grave",4,https://open.spotify.com/track/7lrhugjSbiImrNSLIFIq0c?si=e3a9101b8fca4e62
242,3623825,Not,Big Thief,2019,15,"It's not the room
Not beginning
Not the crowd
Not winning",4,https://open.spotify.com/track/7lrhugjSbiImrNSLIFIq0c?si=e3a9101b8fca4e63
243,3623825,Not,Big Thief,2019,16,"Not the planet
Not spinning
Not a ruse
Not heat",4,https://open.spotify.com/track/7lrhugjSbiImrNSLIFIq0c?si=e3a9101b8fca4e64
244,3623825,Not,Big Thief,2019,17,"Not the fire lapping up the creek
Not food
Not to eat
Not to die",4,https://open.spotify.com/track/7lrhugjSbiImrNSLIFIq0c?si=e3a9101b8fca4e65
245,3623825,Not,Big Thief,2019,18,"Not dying
Not to laugh
Not lying
Not the vacant wilderness vying",4,https://open.spotify.com/track/7lrhugjSbiImrNSLIFIq0c?si=e3a9101b8fca4e66
246,3623825,Not,Big Thief,2019,19,"Not the room
Not beginning
Not the crowd
Not winning",4,https://open.spotify.com/track/7lrhugjSbiImrNSLIFIq0c?si=e3a9101b8fca4e67
247,3623825,Not,Big Thief,2019,20,"Not the planet
Not spinning",2,https://open.spotify.com/track/7lrhugjSbiImrNSLIFIq0c?si=e3a9101b8fca4e68
248,3710189,Wide Winged Bird I,Big Thief,2018,1,"Sitting on steps, the topmost
There's a pasture before me
Where the brief shadows of small trees are plain to see at 2 a.m
Where the moon lights the back of a head",4,
249,3710189,Wide Winged Bird I,Big Thief,2018,2,"Bowed in respect of all that is
I'm not sure I want to talk anymore
Maybe there is something I could say a poet would feel
Maybe there's no need",4,
250,3710189,Wide Winged Bird I,Big Thief,2018,3,"A true poet already sits beside me
Head bowed to the moonlight
I am at once alone and inside everything
Even in the den of the world there is a silence that sings of reverence",4,
251,3710189,Wide Winged Bird I,Big Thief,2018,4,"There is a space that cannot be described
In that space words are noise:
Substantiated evidence of distraction, a step behind now
An understandable preoccupation of the mind's attempt at solving a mystery",4,
252,3710189,Wide Winged Bird I,Big Thief,2018,5,"So I am not sure if I want to talk anymore
Some days my heart is heavier than I knew I could bear
Some days it floats beyond gravity's reach
And words are heavy",4,
253,3710189,Wide Winged Bird I,Big Thief,2018,6,"To use them lets loose an anchor that only proves the science of causality
I know these things
Though the knowing mostly serves as a reminder of an absence
Maybe only momentary, or",4,
254,3710189,Wide Winged Bird I,Big Thief,2018,7,"Until the moon shines once more on a poet's bowed head
So I am not sure I want (much) to talk
There is no sayable clarity
No translation in large print",4,
255,3710189,Wide Winged Bird I,Big Thief,2018,8,"There is only this moment
And I live inside it alone
But look upon the world with eyes that say what can't be said",3,
256,3710272,I Wanna Know Why Wide Winged Bird Version,Big Thief,2018,1,"Joni sang me a story
Misty-eyed train ride New York rain
In the morning
Time's not ticking, it's pouring",4,
257,3710272,I Wanna Know Why Wide Winged Bird Version,Big Thief,2018,2,"Each tock like a drop of the melting sun
Sun warming",2,
258,3710272,I Wanna Know Why Wide Winged Bird Version,Big Thief,2018,3,"Well some tired ghost came by
Didn't even try
You were out waving goodbye
With arms open wide to the sky",4,
259,3710272,I Wanna Know Why Wide Winged Bird Version,Big Thief,2018,4,"Oh my love, I want to know why
Why you call to me this way",2,
260,3710272,I Wanna Know Why Wide Winged Bird Version,Big Thief,2018,5,"Come on, come to me, my love
Fast on the arms of the eastern light
Through the window
Now I am trying to forgive you",4,
261,3710272,I Wanna Know Why Wide Winged Bird Version,Big Thief,2018,6,"But nothing I ever do takes you
Brings you back",2,
262,3710272,I Wanna Know Why Wide Winged Bird Version,Big Thief,2018,7,"Well some tired ghost came by
Didn't even try
You were out waving goodbye
With arms open wide to the sky",4,
263,3710272,I Wanna Know Why Wide Winged Bird Version,Big Thief,2018,8,"Oh my love, I want to know why
My love, I want to know why
My love I want to know
Why you call to me this way",4,
264,3710272,I Wanna Know Why Wide Winged Bird Version,Big Thief,2018,9,"I should just sell that to Nashville
Was that, was that it?
It's the second of the A
And the chord before it",4,
265,3710358,Black Flowers Wide Winged Bird Version,Big Thief,2018,1,"Walking home in her dirty clothes
She is a flower that no one knows
And the man her blue eyes hold
I can see it now, in the way they glow",4,
266,3710358,Black Flowers Wide Winged Bird Version,Big Thief,2018,2,She gave blood to him for me,1,
267,3710358,Black Flowers Wide Winged Bird Version,Big Thief,2018,3,"Oh, the blade of the old man's knife
How he carved his twisted life
Through her young body in the hard, white light
And her eyes, they fell as black as night",4,
268,3710358,Black Flowers Wide Winged Bird Version,Big Thief,2018,4,She gave blood to him for me,1,
269,3710358,Black Flowers Wide Winged Bird Version,Big Thief,2018,5,"Her little wrists
Her little hands
Black flowers land
Into her future child",4,
270,3710358,Black Flowers Wide Winged Bird Version,Big Thief,2018,6,"I see my momma at 15
Dancing like a disco queen
I see my father, he was 43
And he held her down, saying, """"Don't you scream.""""",4,
271,3710358,Black Flowers Wide Winged Bird Version,Big Thief,2018,7,She gave blood to him for me,1,
272,3710358,Black Flowers Wide Winged Bird Version,Big Thief,2018,8,"Her little wrists
Her little hands
Black flowers land
Into her future",4,
273,3710358,Black Flowers Wide Winged Bird Version,Big Thief,2018,9,"My mother
My mother
My mother",3,
274,3712442,Iris Wide Winged Bird Version,Big Thief,2018,1,"We jumped straight into
The iris of the lake
You threw your arms around my neck, you knew
My heart was yours",4,
275,3712442,Iris Wide Winged Bird Version,Big Thief,2018,2,My heart was yours,1,
276,3712442,Iris Wide Winged Bird Version,Big Thief,2018,3,"Stay up late into
The iris of the day
You said just one more cigarette, you knew
My heart was yours",4,
277,3712442,Iris Wide Winged Bird Version,Big Thief,2018,4,My heart was yours,1,
278,3712442,Iris Wide Winged Bird Version,Big Thief,2018,5,"Man you change, you grew
You grew another face
You chewed my flesh and spit the taste, you knew
My heart was yours",4,
279,3712442,Iris Wide Winged Bird Version,Big Thief,2018,6,My heart was yours,1,
280,3712442,Iris Wide Winged Bird Version,Big Thief,2018,7,"And everybody and I never knew before
You tell me what you needed and you need a little
You know that you a ten and it ain't you again
I know, I know, I know, oh",4,
281,3712442,Iris Wide Winged Bird Version,Big Thief,2018,8,"Oh everybody and I never knew before
You tell me what you needed and you want a little
You know you a da-na-na-na-na-na-na-na-na
I know, I know, I know",4,
282,3728253,Shoulders,Big Thief,2019,1,"Please wake up
Please wake up
Touch my skin and
Tell me where you've been",4,https://open.spotify.com/track/79zOjwivNbq4XVaWufOyvu?si=720a65a57722457d
283,3728253,Shoulders,Big Thief,2019,2,"You brought me in
You brought me in
So touch my skin and
Tell me where you've been",4,https://open.spotify.com/track/79zOjwivNbq4XVaWufOyvu?si=720a65a57722457d
284,3728253,Shoulders,Big Thief,2019,3,"You showed me how
To keep myself from burning out",2,https://open.spotify.com/track/79zOjwivNbq4XVaWufOyvu?si=720a65a57722457d
285,3728253,Shoulders,Big Thief,2019,4,"They found you in the morning
The blood was on your shoulders
They found you at the corner
Your head was doubled over",4,https://open.spotify.com/track/79zOjwivNbq4XVaWufOyvu?si=720a65a57722457d
286,3728253,Shoulders,Big Thief,2019,5,"And the blood of the man
Who killed my mother with his hands
Is in me, it's in me, in my veins",3,https://open.spotify.com/track/79zOjwivNbq4XVaWufOyvu?si=720a65a57722457d
287,3728253,Shoulders,Big Thief,2019,6,"Please wake up
Please wake up
Touch my skin and
Tell me where you've been",4,https://open.spotify.com/track/79zOjwivNbq4XVaWufOyvu?si=720a65a57722457d
288,3728253,Shoulders,Big Thief,2019,7,"You brought me in
My best friend
So touch my skin and
Tell me where you've been",4,https://open.spotify.com/track/79zOjwivNbq4XVaWufOyvu?si=720a65a57722457d
289,3728253,Shoulders,Big Thief,2019,8,"You showed me how
To hold my sin
And kiss the bad ways I have been",3,https://open.spotify.com/track/79zOjwivNbq4XVaWufOyvu?si=720a65a57722457d
290,3728253,Shoulders,Big Thief,2019,9,"They found you in the morning
The blood was on your shoulders
They found you at the corner
Your head was doubled over",4,https://open.spotify.com/track/79zOjwivNbq4XVaWufOyvu?si=720a65a57722457d
291,3728253,Shoulders,Big Thief,2019,10,"And the blood of the man
Who's killing our mother with his hands
Is in me, it's in me, in my veins
It's in me, it's in me, in my veins",4,https://open.spotify.com/track/79zOjwivNbq4XVaWufOyvu?si=720a65a57722457d
292,4345993,Magic Dealer,Big Thief,2019,1,"Starve, magic mirror
I thought the crumbs of your life wouldn't dry
It hurts to see clearer
Falling like needles, the passage of time",4,https://open.spotify.com/track/4hgznG7Etsjll9qkHucCDO?si=53d21f31d0a54b66
293,4345993,Magic Dealer,Big Thief,2019,2,"Would it hurt, would it hurt to be nearer?
Heaven is stitching across me
My chest is the crossing
The blood is parting all the time, but I don't mind",4,https://open.spotify.com/track/4hgznG7Etsjll9qkHucCDO?si=53d21f31d0a54b67
294,4345993,Magic Dealer,Big Thief,2019,3,"Carve magic dealer
Bring me the company I couldn't buy
As I go cleaner
Falling like needles, the passage of time",4,https://open.spotify.com/track/4hgznG7Etsjll9qkHucCDO?si=53d21f31d0a54b68
295,4345993,Magic Dealer,Big Thief,2019,4,"Would it help, would it help to go deeper?
I am the photograph in you
The photograph in you
Still as the moment we're lying in right now",4,https://open.spotify.com/track/4hgznG7Etsjll9qkHucCDO?si=53d21f31d0a54b69
296,4345988,Open Desert,Big Thief,2019,1,"Vacant angel, crimson light
Darkened eyelash, darkened eye
The white light of the living room
Leaking through the crack in the door",4,https://open.spotify.com/track/79GNPyz34aVNeAZXXVlrLv?si=72f12711c41d4103
297,4345988,Open Desert,Big Thief,2019,2,"There was never need for more
Things we're meant to understand
Crawling closer to your hand",3,https://open.spotify.com/track/79GNPyz34aVNeAZXXVlrLv?si=72f12711c41d4104
298,4345988,Open Desert,Big Thief,2019,3,"To the poison image
Brave surrender
Kiss the water",3,https://open.spotify.com/track/79GNPyz34aVNeAZXXVlrLv?si=72f12711c41d4105
299,4345988,Open Desert,Big Thief,2019,4,"After all my teeth are gone
After all the blood is drawn
The white light of the waiting room
Leaking through the crack in the door",4,https://open.spotify.com/track/79GNPyz34aVNeAZXXVlrLv?si=72f12711c41d4106
300,4345988,Open Desert,Big Thief,2019,5,"Through the poison image
Brave surrender
Kiss the water",3,https://open.spotify.com/track/79GNPyz34aVNeAZXXVlrLv?si=72f12711c41d4107
301,4345988,Open Desert,Big Thief,2019,6,"Through the mirror, mountain view
She has one green, one eye blue
I can see her smiling through
The white light of the living room",4,https://open.spotify.com/track/79GNPyz34aVNeAZXXVlrLv?si=72f12711c41d4108
302,4345988,Open Desert,Big Thief,2019,7,Leaking through the crack in the door,1,https://open.spotify.com/track/79GNPyz34aVNeAZXXVlrLv?si=72f12711c41d4109
303,4345989,Century,Big Thief,2019,1,"Dogs eyes in the headlights of the driveway
Cool autumn rain
Bugs died on your windshield on the freeway
Wonder if you'll be the same",4,https://open.spotify.com/track/5VgHyTScSLqpTai6oQjird?si=21ec53c532aa42f4
304,4345989,Century,Big Thief,2019,2,Centuries flower,1,https://open.spotify.com/track/5VgHyTScSLqpTai6oQjird?si=21ec53c532aa42f5
305,4345989,Century,Big Thief,2019,3,"And we have the same power
We have the same power
We have the same power
We have the same power",4,https://open.spotify.com/track/5VgHyTScSLqpTai6oQjird?si=21ec53c532aa42f6
306,4345989,Century,Big Thief,2019,4,"Moth flies in the window of the kitchen
You hang up your coat
Cold lips and gold eyes listen
There's something that I want you to know",4,https://open.spotify.com/track/5VgHyTScSLqpTai6oQjird?si=21ec53c532aa42f7
307,4345989,Century,Big Thief,2019,5,Turn on the shower,1,https://open.spotify.com/track/5VgHyTScSLqpTai6oQjird?si=21ec53c532aa42f8
308,4345989,Century,Big Thief,2019,6,"'Cause we have the same power
We have the same power
We have the same power
We have the same power",4,https://open.spotify.com/track/5VgHyTScSLqpTai6oQjird?si=21ec53c532aa42f9
309,4345989,Century,Big Thief,2019,7,"No resolution, no circling dove
Still caught in the jaw of confusion
Don't know what I'd do for love
But stay another hour",4,https://open.spotify.com/track/5VgHyTScSLqpTai6oQjird?si=21ec53c532aa42f10
310,4345989,Century,Big Thief,2019,8,"'Cause we have the same power
We have the same power
We have the same power
We have the same power",4,https://open.spotify.com/track/5VgHyTScSLqpTai6oQjird?si=21ec53c532aa42f11
311,4345990,Strange,Big Thief,2019,1,"Doesn't it seem strange
Searching for a hidden page
The fairy’s cage
Coming of true age",4,https://open.spotify.com/track/0y8c74ezNCYou4FrX4xI8v?si=bba6fba1558b4dab
312,4345990,Strange,Big Thief,2019,2,"Leave the costume on the stage
The silkworm's rage
Iridescent thread, beautiful and dead
Billions of worms were boiled to make the bed",4,https://open.spotify.com/track/0y8c74ezNCYou4FrX4xI8v?si=bba6fba1558b4dab
313,4345990,Strange,Big Thief,2019,3,"Strange, see the luna moth cry
Lime green tears through the fruit bat's eyes",2,https://open.spotify.com/track/0y8c74ezNCYou4FrX4xI8v?si=bba6fba1558b4dab
314,4345990,Strange,Big Thief,2019,4,"Scatter and destroy
Every power you enjoy
To lay with the void
Twirling of the dime, splitting of the mind",4,https://open.spotify.com/track/0y8c74ezNCYou4FrX4xI8v?si=bba6fba1558b4dab
315,4345990,Strange,Big Thief,2019,5,Drawing constellations ’til the stars align,1,https://open.spotify.com/track/0y8c74ezNCYou4FrX4xI8v?si=bba6fba1558b4dab
316,4345990,Strange,Big Thief,2019,6,"Strange, see the luna moth cry (Cry)
Lime green tears through the fruit bat's eyes (Eyes)",2,https://open.spotify.com/track/0y8c74ezNCYou4FrX4xI8v?si=bba6fba1558b4dab
317,4345990,Strange,Big Thief,2019,7,"You have wings of gold
You will never grow old
And turquoise lungs
You have never been young",4,https://open.spotify.com/track/0y8c74ezNCYou4FrX4xI8v?si=bba6fba1558b4dab
318,4345990,Strange,Big Thief,2019,8,"You have wings of gold
You will never grow old
And turquoise lungs
You have never been young",4,https://open.spotify.com/track/0y8c74ezNCYou4FrX4xI8v?si=bba6fba1558b4dab
319,4345991,Betsy,Big Thief,2019,1,"Driving through the night
Rings of crystal, crystal light
Every gulp of the warm suburb air
Betsy's auburn, auburn hair",4,https://open.spotify.com/track/3gmmqbwuSVfLokKAPcBQha?si=5265e30eec5a4fad
320,4345991,Betsy,Big Thief,2019,2,"Ooh, ooh",1,https://open.spotify.com/track/3gmmqbwuSVfLokKAPcBQha?si=5265e30eec5a4fad
321,4345991,Betsy,Big Thief,2019,3,"Drive into New York with me
How she keeps me calm
Street lights, boys and poison palms",3,https://open.spotify.com/track/3gmmqbwuSVfLokKAPcBQha?si=5265e30eec5a4fad
322,4345991,Betsy,Big Thief,2019,4,"Ooh, ooh",1,https://open.spotify.com/track/3gmmqbwuSVfLokKAPcBQha?si=5265e30eec5a4fad
323,4345991,Betsy,Big Thief,2019,5,"Drive into New York with me
Big lights in the city",2,https://open.spotify.com/track/3gmmqbwuSVfLokKAPcBQha?si=5265e30eec5a4fad
324,4345991,Betsy,Big Thief,2019,6,"Ooh, ooh
Ooh, ooh
Ooh, ooh",3,https://open.spotify.com/track/3gmmqbwuSVfLokKAPcBQha?si=5265e30eec5a4fad
325,4345992,Jenni,Big Thief,2019,1,"Too hot to breathe
Too hot to breathe
Too hot to breathe",3,https://open.spotify.com/track/3vxZeKCnE307g5mzb7ddkp?si=5feb5035e3744d3e
326,4345992,Jenni,Big Thief,2019,2,"Jenni's in my room
Jenni’s in my room
Jenni's in my room",3,https://open.spotify.com/track/3vxZeKCnE307g5mzb7ddkp?si=5feb5035e3744d3e
327,4345992,Jenni,Big Thief,2019,3,"Her skin so bare
The fragrant air
Her vacant eye",3,https://open.spotify.com/track/3vxZeKCnE307g5mzb7ddkp?si=5feb5035e3744d3e
328,4345992,Jenni,Big Thief,2019,4,"Jenni's in my room
Jenni’s in my room
Jenni's in my room",3,https://open.spotify.com/track/3vxZeKCnE307g5mzb7ddkp?si=5feb5035e3744d3e
329,4345992,Jenni,Big Thief,2019,5,"The signal swarms
The portal forms
She calls me through",3,https://open.spotify.com/track/3vxZeKCnE307g5mzb7ddkp?si=5feb5035e3744d3e
330,4345992,Jenni,Big Thief,2019,6,"Jenni's in my room
Jenni's in my room
Jenni's in my room",3,https://open.spotify.com/track/3vxZeKCnE307g5mzb7ddkp?si=5feb5035e3744d3e
331,4345992,Jenni,Big Thief,2019,7,"Jenni's in my room
Jenni's in my room
Jenni
Jenni's in my room",4,https://open.spotify.com/track/3vxZeKCnE307g5mzb7ddkp?si=5feb5035e3744d3e
332,4345980,UFOF,Big Thief,2019,1,"To my UFO friend
Goodbye, goodbye
Like a seed in the wind
She's taking up root in the sky",4,https://open.spotify.com/track/3Hbwbuk3ChdUf7M6Cn7uQB?si=cc087f9df26a498d
333,4345980,UFOF,Big Thief,2019,2,"See her flickering
Her system won't even try
To defend and ripen
In the radio action",4,https://open.spotify.com/track/3Hbwbuk3ChdUf7M6Cn7uQB?si=cc087f9df26a498d
334,4345980,UFOF,Big Thief,2019,3,"She'll never return again
Polarize, polarize
The seasons will bend
There will soon be proof",4,https://open.spotify.com/track/3Hbwbuk3ChdUf7M6Cn7uQB?si=cc087f9df26a498d
335,4345980,UFOF,Big Thief,2019,4,"That there is no alien
Just a system of truth and lies
The reason, the language
And the law of attraction",4,https://open.spotify.com/track/3Hbwbuk3ChdUf7M6Cn7uQB?si=cc087f9df26a498d
336,4345980,UFOF,Big Thief,2019,5,"Just like a bad dream
You'll disappear
Another map turns blue
Mirror on mirror",4,https://open.spotify.com/track/3Hbwbuk3ChdUf7M6Cn7uQB?si=cc087f9df26a498d
337,4345980,UFOF,Big Thief,2019,6,"And I imagine you
Taking me outta here
To deepen our love
It isn't even a fraction",4,https://open.spotify.com/track/3Hbwbuk3ChdUf7M6Cn7uQB?si=cc087f9df26a498d
338,4345980,UFOF,Big Thief,2019,7,"Switch to another lens
The last sunlight
I don't need any other friends
The best kiss I ever had is the flickering",4,https://open.spotify.com/track/3Hbwbuk3ChdUf7M6Cn7uQB?si=cc087f9df26a498d
339,4345980,UFOF,Big Thief,2019,8,"Of the water so clear and bright
To leap in, my skin
And I could feel the reaction",3,https://open.spotify.com/track/3Hbwbuk3ChdUf7M6Cn7uQB?si=cc087f9df26a498d
340,4345980,UFOF,Big Thief,2019,9,"Just like a bad dream
You'll disappear
Another map turns blue
Mirror on mirror",4,https://open.spotify.com/track/3Hbwbuk3ChdUf7M6Cn7uQB?si=cc087f9df26a498d
341,4345980,UFOF,Big Thief,2019,10,"And I imagine you
Taking me outta here
To deepen our love
It isn't even a fraction",4,https://open.spotify.com/track/3Hbwbuk3ChdUf7M6Cn7uQB?si=cc087f9df26a498d
342,4345980,UFOF,Big Thief,2019,11,"Just like a bad dream
You'll disappear
Another map turns blue
Mirror on mirror",4,https://open.spotify.com/track/3Hbwbuk3ChdUf7M6Cn7uQB?si=cc087f9df26a498d
343,4345980,UFOF,Big Thief,2019,12,"And I imagine you
Taking me outta here
To deepen our love
It isn't even a fraction",4,https://open.spotify.com/track/3Hbwbuk3ChdUf7M6Cn7uQB?si=cc087f9df26a498d
344,4345985,Contact,Big Thief,2019,1,"Jodi
Please turn the pages for me
You seem so free
You know I'm barely, barely",4,https://open.spotify.com/track/3sVuke7aCuUQSJxwPSu3Eu?si=1ef1de4919a7480a
345,4345985,Contact,Big Thief,2019,2,"Wrap me in silk
I want to drink your milk
You hold the key
You know I'm barely, barely",4,https://open.spotify.com/track/3sVuke7aCuUQSJxwPSu3Eu?si=1ef1de4919a7480a
346,4345985,Contact,Big Thief,2019,3,"Parker Lake Beach
All of the sunnys swimming
I wanna see
To feel my body sinking, sinking",4,https://open.spotify.com/track/3sVuke7aCuUQSJxwPSu3Eu?si=1ef1de4919a7480a
347,4345985,Contact,Big Thief,2019,4,"She gives me gills
Helps me forgive the pills
She makes me sing
She is both dreamer and dream",4,https://open.spotify.com/track/3sVuke7aCuUQSJxwPSu3Eu?si=1ef1de4919a7480a
348,4345985,Contact,Big Thief,2019,5,"And dream, and dream, and dream",1,https://open.spotify.com/track/3sVuke7aCuUQSJxwPSu3Eu?si=1ef1de4919a7480a
349,4345986,Cattails,Big Thief,2019,1,"Caroline, Caroline
I never could leave you to struggle
Hold the line, hold the line
I’ll be there on the double",4,https://open.spotify.com/track/1zNLILPGGfMdEnifTrnY3z?si=bede6854d9b747a8
350,4345986,Cattails,Big Thief,2019,2,"In time, in time
Everyone does see trouble",2,https://open.spotify.com/track/1zNLILPGGfMdEnifTrnY3z?si=bede6854d9b747a9
351,4345986,Cattails,Big Thief,2019,3,"And you don’t need to know why when you cry
You don’t need to know why
You don’t need to know why when you cry",3,https://open.spotify.com/track/1zNLILPGGfMdEnifTrnY3z?si=bede6854d9b747a10
352,4345986,Cattails,Big Thief,2019,4,"Violet’s eyes, Violet plays
Going back home to the Great Lakes
Where the cattail sways
With the lonesome loon",4,https://open.spotify.com/track/1zNLILPGGfMdEnifTrnY3z?si=bede6854d9b747a11
353,4345986,Cattails,Big Thief,2019,5,Riding that train in late June,1,https://open.spotify.com/track/1zNLILPGGfMdEnifTrnY3z?si=bede6854d9b747a12
354,4345986,Cattails,Big Thief,2019,6,"With the windows wide by my side
With the windows wide
With the windows wide by my side",3,https://open.spotify.com/track/1zNLILPGGfMdEnifTrnY3z?si=bede6854d9b747a13
355,4345986,Cattails,Big Thief,2019,7,"And the clusters fell like an empty bell
Meteor shower at the motel
Where the empty space is a saving grace
Making good time and doing well",4,https://open.spotify.com/track/1zNLILPGGfMdEnifTrnY3z?si=bede6854d9b747a14
356,4345986,Cattails,Big Thief,2019,8,"Still the question sings like Saturn’s rings
Maybe she knows and she won’t tell",2,https://open.spotify.com/track/1zNLILPGGfMdEnifTrnY3z?si=bede6854d9b747a15
357,4345986,Cattails,Big Thief,2019,9,"But you don’t need to know why when you cry
You don’t need to know why
You don’t need to know why when you cry",3,https://open.spotify.com/track/1zNLILPGGfMdEnifTrnY3z?si=bede6854d9b747a16
358,4345986,Cattails,Big Thief,2019,10,"And I find you there in your country flair
Middle of the river in a lawn chair
With your wrinkled hands and your silver hair
Leaving here soon and you know where",4,https://open.spotify.com/track/1zNLILPGGfMdEnifTrnY3z?si=bede6854d9b747a17
359,4345986,Cattails,Big Thief,2019,11,"To where the cattail sways with the lonesome loon
You’ll be riding that train in late June",2,https://open.spotify.com/track/1zNLILPGGfMdEnifTrnY3z?si=bede6854d9b747a18
360,4345986,Cattails,Big Thief,2019,12,"With the windows wide by your side
With the windows wide
With the windows wide by your side
You don’t need to know why",4,https://open.spotify.com/track/1zNLILPGGfMdEnifTrnY3z?si=bede6854d9b747a19
361,4345986,Cattails,Big Thief,2019,13,You don’t need to know why when you cry,1,https://open.spotify.com/track/1zNLILPGGfMdEnifTrnY3z?si=bede6854d9b747a20
362,4345987,From,Big Thief,2019,1,"No one can be my man, be my man
Be my man, be my man
Be my man, be my man
No one can be my woman, be my woman",4,https://open.spotify.com/track/6pnyk7XWOC1gtgh1KI2ymo?si=e6f83452ca5543b1
363,4345987,From,Big Thief,2019,2,"Be my woman
One ear to the ground
One dog at my neck
One tongue to my tongue",4,https://open.spotify.com/track/6pnyk7XWOC1gtgh1KI2ymo?si=e6f83452ca5543b2
